{
  "artifact_fingerprints": {
    "_kapelle/verification.json": "06ca2c806b6290aca49f7aba1064eebf17483c308a60245add55c715c59b1c33",
    "design.md": "f34527260553e615cc100ae2563af2ed9bad42ffbb8505d492fd09e800ce4a85",
    "spec.md": "fc826d7bdd159b91405a18086896e5c61facf0a0f728254d871b93ca31e4eed6",
    "specs": "8c2a0aeef0722431a8c6a154fecddfe551e99ec6dbaaa44cd42ca8dfff05f005",
    "tasks.md#structural": "561cb3ae42b3e1f2e38a768e27d285498cdeb7fe0413d96f13a5bebb1479b7e3"
  },
  "confirmation": "Developer explicitly approved final completion in the conversation: \u041e\u043a, \u0437\u0430\u0440\u0430\u043d\u044c.",
  "gate": "final",
  "status": "approved"
}
